{
  "schemaVersion": 1,
  "artifactStatus": "non_canonical_ai_draft",
  "source": {
    "file": "data/wikivoyage-phrases.ts",
    "license": "CC BY-SA",
    "itemCount": 621,
    "fingerprint": "3f769ea1e2894c437c9ef4e8ccb95d694bd83323e549622b4500f877fedd5ff3"
  },
  "pipeline": {
    "name": "kannada-buddy-library-enrichment",
    "version": "1.0.0",
    "generatedAt": "2026-07-29T15:23:06.858Z",
    "validationClaim": "automated_draft_not_human_or_native_review"
  },
  "summary": {
    "scope": "pilot",
    "itemCount": 40,
    "batchCounts": {
      "clean-basics": 10,
      "clean-food-shop": 10,
      "clean-transport": 10,
      "deliberate-anomalies": 10
    },
    "riskCounts": {
      "low": 30,
      "medium": 8,
      "high": 2
    },
    "reviewQueueCounts": {
      "automated_reference": 30,
      "standard_human_review": 8,
      "priority_human_review": 2
    }
  },
  "items": [
    {
      "sourceId": "wv-more-basics-is-it-good",
      "sourceOccurrence": 1,
      "draftId": "wv-more-basics-is-it-good#1",
      "sourceHash": "7233baa5783a5acd59b32e0cf62c7bdd72f9d59fc574b5f3cb1c0b816bd84121",
      "pilotBatch": "clean-basics",
      "sourcePhrase": {
        "english": "Is it good?",
        "kannadaScript": "ಚೆನ್ನಾಗ್’ಇದೆಯಾ?",
        "kannadaRoman": "cennAg'ideyA?",
        "category": "basics",
        "tags": [
          "wikivoyage",
          "more-basics"
        ]
      },
      "draft": {
        "english": "Is it good?",
        "kannadaScript": "ಚೆನ್ನಾಗ್’ಇದೆಯಾ?",
        "kannadaRoman": "cennAg'ideyA?",
        "category": "basics",
        "tags": [
          "wikivoyage",
          "more-basics",
          "automated-draft",
          "low-risk"
        ],
        "register": "neutral",
        "bengaluruNaturalness": "general_kannada_candidate",
        "usageContext": "General conversation and everyday interaction."
      },
      "assessment": {
        "risk": "low",
        "issues": [],
        "scriptHasKannada": true,
        "romanizationSurfaceCheck": "surface_plausible",
        "semanticCheck": "not_automatically_verified",
        "draftConfidence": 0.9,
        "notes": [
          "This is an automated reference draft, not human or native-speaker approval."
        ]
      },
      "reviewQueue": "automated_reference",
      "publicationEligibility": "library_ai_draft",
      "reviewClaim": "not_human_or_native_reviewed"
    },
    {
      "sourceId": "wv-more-basics-it-is-fine",
      "sourceOccurrence": 1,
      "draftId": "wv-more-basics-it-is-fine#1",
      "sourceHash": "d5650675292c65529f0bad4aff75bfc226bd4ce1e25dc61a05b4b201e62aa7d9",
      "pilotBatch": "clean-basics",
      "sourcePhrase": {
        "english": "It is fine",
        "kannadaScript": "ಚೆನ್ನಾಗ್’ಇದೆ",
        "kannadaRoman": "cennAg'ide",
        "category": "basics",
        "tags": [
          "wikivoyage",
          "more-basics"
        ]
      },
      "draft": {
        "english": "It is fine",
        "kannadaScript": "ಚೆನ್ನಾಗ್’ಇದೆ",
        "kannadaRoman": "cennAg'ide",
        "category": "basics",
        "tags": [
          "wikivoyage",
          "more-basics",
          "automated-draft",
          "low-risk"
        ],
        "register": "neutral",
        "bengaluruNaturalness": "general_kannada_candidate",
        "usageContext": "General conversation and everyday interaction."
      },
      "assessment": {
        "risk": "low",
        "issues": [],
        "scriptHasKannada": true,
        "romanizationSurfaceCheck": "surface_plausible",
        "semanticCheck": "not_automatically_verified",
        "draftConfidence": 0.9,
        "notes": [
          "This is an automated reference draft, not human or native-speaker approval."
        ]
      },
      "reviewQueue": "automated_reference",
      "publicationEligibility": "library_ai_draft",
      "reviewClaim": "not_human_or_native_reviewed"
    },
    {
      "sourceId": "wv-more-basics-it-is-not-good",
      "sourceOccurrence": 1,
      "draftId": "wv-more-basics-it-is-not-good#1",
      "sourceHash": "9e5e0f0f82c156a8c5210b300a30bef8c4703799a8ace2bc37b1e1a36f593d4e",
      "pilotBatch": "clean-basics",
      "sourcePhrase": {
        "english": "It is not good",
        "kannadaScript": "ಚೆನ್ನಾಗ್’ಇಲ್ಲ",
        "kannadaRoman": "cennAg'illa",
        "category": "basics",
        "tags": [
          "wikivoyage",
          "more-basics"
        ]
      },
      "draft": {
        "english": "It is not good",
        "kannadaScript": "ಚೆನ್ನಾಗ್’ಇಲ್ಲ",
        "kannadaRoman": "cennAg'illa",
        "category": "basics",
        "tags": [
          "wikivoyage",
          "more-basics",
          "automated-draft",
          "low-risk"
        ],
        "register": "neutral",
        "bengaluruNaturalness": "general_kannada_candidate",
        "usageContext": "General conversation and everyday interaction."
      },
      "assessment": {
        "risk": "low",
        "issues": [],
        "scriptHasKannada": true,
        "romanizationSurfaceCheck": "surface_plausible",
        "semanticCheck": "not_automatically_verified",
        "draftConfidence": 0.9,
        "notes": [
          "This is an automated reference draft, not human or native-speaker approval."
        ]
      },
      "reviewQueue": "automated_reference",
      "publicationEligibility": "library_ai_draft",
      "reviewClaim": "not_human_or_native_reviewed"
    },
    {
      "sourceId": "wv-more-basics-alright",
      "sourceOccurrence": 1,
      "draftId": "wv-more-basics-alright#1",
      "sourceHash": "db5e0ec91c4083318ef855d13781cc709da946e2d87b80a4e0b58911e63c1779",
      "pilotBatch": "clean-basics",
      "sourcePhrase": {
        "english": "Alright",
        "kannadaScript": "ಸರಿ",
        "kannadaRoman": "sari",
        "category": "basics",
        "tags": [
          "wikivoyage",
          "more-basics"
        ]
      },
      "draft": {
        "english": "Alright",
        "kannadaScript": "ಸರಿ",
        "kannadaRoman": "sari",
        "category": "basics",
        "tags": [
          "wikivoyage",
          "more-basics",
          "automated-draft",
          "low-risk"
        ],
        "register": "neutral",
        "bengaluruNaturalness": "general_kannada_candidate",
        "usageContext": "General conversation and everyday interaction."
      },
      "assessment": {
        "risk": "low",
        "issues": [],
        "scriptHasKannada": true,
        "romanizationSurfaceCheck": "surface_plausible",
        "semanticCheck": "not_automatically_verified",
        "draftConfidence": 0.9,
        "notes": [
          "This is an automated reference draft, not human or native-speaker approval."
        ]
      },
      "reviewQueue": "automated_reference",
      "publicationEligibility": "library_ai_draft",
      "reviewClaim": "not_human_or_native_reviewed"
    },
    {
      "sourceId": "wv-more-basics-that-is-all",
      "sourceOccurrence": 1,
      "draftId": "wv-more-basics-that-is-all#1",
      "sourceHash": "2e23f9245434df0ccec87574b536965dead95146e2f4c1378f59f18b8dabcea9",
      "pilotBatch": "clean-basics",
      "sourcePhrase": {
        "english": "That is all",
        "kannadaScript": "ಅಷ್ಟೇ",
        "kannadaRoman": "aShTE",
        "category": "basics",
        "tags": [
          "wikivoyage",
          "more-basics"
        ]
      },
      "draft": {
        "english": "That is all",
        "kannadaScript": "ಅಷ್ಟೇ",
        "kannadaRoman": "aShTE",
        "category": "basics",
        "tags": [
          "wikivoyage",
          "more-basics",
          "automated-draft",
          "low-risk"
        ],
        "register": "neutral",
        "bengaluruNaturalness": "general_kannada_candidate",
        "usageContext": "General conversation and everyday interaction."
      },
      "assessment": {
        "risk": "low",
        "issues": [],
        "scriptHasKannada": true,
        "romanizationSurfaceCheck": "surface_plausible",
        "semanticCheck": "not_automatically_verified",
        "draftConfidence": 0.9,
        "notes": [
          "This is an automated reference draft, not human or native-speaker approval."
        ]
      },
      "reviewQueue": "automated_reference",
      "publicationEligibility": "library_ai_draft",
      "reviewClaim": "not_human_or_native_reviewed"
    },
    {
      "sourceId": "wv-more-basics-there-is-plenty",
      "sourceOccurrence": 1,
      "draftId": "wv-more-basics-there-is-plenty#1",
      "sourceHash": "02635527814a49c68fd272e419b8c2d6593d246cae9c1ea8afa24eed4e6ed4db",
      "pilotBatch": "clean-basics",
      "sourcePhrase": {
        "english": "There is plenty",
        "kannadaScript": "ಬೇಕಾದ್’ಅಷ್ಟ್’ಇದೆ",
        "kannadaRoman": "bEkAd'aShT'ide",
        "category": "basics",
        "tags": [
          "wikivoyage",
          "more-basics"
        ]
      },
      "draft": {
        "english": "There is plenty",
        "kannadaScript": "ಬೇಕಾದ್’ಅಷ್ಟ್’ಇದೆ",
        "kannadaRoman": "bEkAd'aShT'ide",
        "category": "basics",
        "tags": [
          "wikivoyage",
          "more-basics",
          "automated-draft",
          "low-risk"
        ],
        "register": "neutral",
        "bengaluruNaturalness": "general_kannada_candidate",
        "usageContext": "General conversation and everyday interaction."
      },
      "assessment": {
        "risk": "low",
        "issues": [],
        "scriptHasKannada": true,
        "romanizationSurfaceCheck": "surface_plausible",
        "semanticCheck": "not_automatically_verified",
        "draftConfidence": 0.9,
        "notes": [
          "This is an automated reference draft, not human or native-speaker approval."
        ]
      },
      "reviewQueue": "automated_reference",
      "publicationEligibility": "library_ai_draft",
      "reviewClaim": "not_human_or_native_reviewed"
    },
    {
      "sourceId": "wv-more-basics-please-take",
      "sourceOccurrence": 1,
      "draftId": "wv-more-basics-please-take#1",